{
  "$schema": "https://json-schema.org/draft/2020-12/schema",
  "title": "Loop status",
  "description": "What is true right now for every loop and concern of one project, as loop-status derives it from facts: the board, the queue of what needs a person, and what agents can start now. The loop-status script writes it with --json, and every reader of a project's status reads exactly this. schema_version is the version of this file; raise it whenever a change would make a reader of the previous version misread a document, and update every fixture and reader in the same change.",
  "type": "object",
  "required": ["schema_version", "project", "as_of", "main", "environments", "loops", "queue", "agents_can_start", "drift", "missing"],
  "additionalProperties": false,
  "properties": {
    "schema_version": {
      "description": "The version of this schema that the document was written for.",
      "type": "integer",
      "const": 1
    },
    "project": {
      "description": "The key of the project the document describes, usually its repository as owner/name. Every document describes exactly one project.",
      "type": "string",
      "minLength": 1
    },
    "as_of": {
      "description": "When the facts were gathered, in UTC. It is one of the facts, so deriving twice from the same facts gives the same document.",
      "type": "string",
      "pattern": "^[0-9]{4}-[0-9]{2}-[0-9]{2}T[0-9]{2}:[0-9]{2}:[0-9]{2}Z$"
    },
    "main": {"$ref": "#/$defs/main"},
    "environments": {
      "description": "Every environment in LOOP.md §3, lowest first, with the commit it serves or why that could not be read.",
      "type": "array",
      "items": {"$ref": "#/$defs/environment"}
    },
    "loops": {
      "description": "Every loop in docs/loops/.",
      "type": "array",
      "items": {"$ref": "#/$defs/loop"}
    },
    "queue": {
      "description": "What needs a person (the board's 'Needs you'), most unblocking first: sorted by the length of unblocks, longest first.",
      "type": "array",
      "items": {"$ref": "#/$defs/queue_item"}
    },
    "agents_can_start": {
      "description": "Work an agent can start now without a person: ready concerns to build, shipped and stale ones to prove, incomplete contracts to design.",
      "type": "array",
      "items": {"$ref": "#/$defs/start"}
    },
    "drift": {
      "description": "Documents whose text the facts contradict, and other drift the board flags.",
      "type": "array",
      "items": {"$ref": "#/$defs/drift"}
    },
    "missing": {
      "description": "Facts that could not be read for the whole project, such as pull requests when the forge is unreachable. Whatever depends on them is unknown.",
      "type": "array",
      "items": {"$ref": "#/$defs/missing_fact"}
    }
  },
  "$defs": {
    "id": {
      "description": "A loop's folder name or a concern's file name without .md.",
      "type": "string",
      "pattern": "^[A-Za-z0-9][A-Za-z0-9._-]*$"
    },
    "concern_ref": {
      "description": "A concern, written <loop>/<concern>.",
      "type": "string",
      "pattern": "^[A-Za-z0-9][A-Za-z0-9._-]*/[A-Za-z0-9][A-Za-z0-9._-]*$"
    },
    "sha": {
      "description": "A commit, abbreviated to at least 7 hex digits or in full.",
      "type": "string",
      "pattern": "^[0-9a-f]{7,40}$"
    },
    "text": {
      "type": "string",
      "minLength": 1
    },
    "concern_state": {
      "description": "A concern's state: exactly the rows of the derivation table in loop-status SKILL.md, in its order, plus unknown when a fact the state depends on cannot be read. Finer detail ('in review', 'proving') belongs in the reason, never in the state.",
      "enum": ["parked", "contradicted", "open", "blocked", "ready", "building", "merged", "shipped", "stale", "done", "unknown"]
    },
    "loop_state": {
      "description": "A loop's state, as step 5 of loop-status SKILL.md derives it, plus unknown when a fact it depends on cannot be read.",
      "enum": ["parked", "open", "backlog", "done", "active", "unknown"]
    },
    "verdict": {
      "enum": ["HOLDS", "CONTRADICTS", "UNPROVEN"]
    },
    "ci_state": {
      "description": "The combined result of the checks on a commit: none when no check ran, unknown when it could not be read.",
      "enum": ["success", "failure", "pending", "none", "unknown"]
    },
    "queue_kind": {
      "description": "What a queue item asks of a person: answer a question, review a pull request, ship to an environment, or approve a record.",
      "enum": ["question", "review", "ship", "record"]
    },
    "main": {
      "description": "The main branch: its head and the result of its checks.",
      "type": "object",
      "required": ["branch", "sha", "ci"],
      "additionalProperties": false,
      "properties": {
        "branch": {"$ref": "#/$defs/text"},
        "sha": {"$ref": "#/$defs/sha"},
        "ci": {"$ref": "#/$defs/ci_state"}
      }
    },
    "environment": {
      "description": "An environment and the commit it serves. Exactly one of served and error is set: an environment that cannot be read is unknown, never assumed.",
      "type": "object",
      "required": ["name", "served", "error"],
      "additionalProperties": false,
      "properties": {
        "name": {"$ref": "#/$defs/text"},
        "served": {"type": ["string", "null"], "pattern": "^[0-9a-f]{7,40}$"},
        "error": {"type": ["string", "null"], "minLength": 1}
      },
      "oneOf": [
        {"properties": {"served": {"type": "string"}, "error": {"type": "null"}}},
        {"properties": {"served": {"type": "null"}, "error": {"type": "string"}}}
      ]
    },
    "loop": {
      "type": "object",
      "required": ["id", "title", "path", "state", "reason", "next", "goals", "concerns"],
      "additionalProperties": false,
      "properties": {
        "id": {"$ref": "#/$defs/id"},
        "title": {"$ref": "#/$defs/text"},
        "path": {"description": "The loop's README, relative to the repository root.", "$ref": "#/$defs/text"},
        "state": {"$ref": "#/$defs/loop_state"},
        "reason": {"description": "The facts behind the state, in one line.", "$ref": "#/$defs/text"},
        "next": {"description": "The command or action that moves the loop on, or null.", "type": ["string", "null"], "minLength": 1},
        "owner": {"description": "The loop's owner: from its front matter, else LOOP.md's owner; null until known.", "type": ["string", "null"], "minLength": 1},
        "members": {"description": "The loop's members, from its front matter.", "type": "array", "items": {"$ref": "#/$defs/text"}, "uniqueItems": true},
        "goals": {"description": "The loop's goals (G#).", "type": "array", "items": {"$ref": "#/$defs/claim"}},
        "concerns": {"type": "array", "items": {"$ref": "#/$defs/concern"}}
      }
    },
    "concern": {
      "type": "object",
      "required": ["id", "title", "path", "contract", "claims", "state", "reason", "next", "inputs"],
      "additionalProperties": false,
      "properties": {
        "id": {"$ref": "#/$defs/id"},
        "title": {"$ref": "#/$defs/text"},
        "path": {"description": "The concern's file, relative to the repository root.", "$ref": "#/$defs/text"},
        "contract": {"$ref": "#/$defs/contract"},
        "claims": {"description": "The concern's claims (C#), in the order of Done when.", "type": "array", "items": {"$ref": "#/$defs/claim"}},
        "state": {"$ref": "#/$defs/concern_state"},
        "reason": {"description": "The facts behind the state, in one line, such as which table row matched and why.", "$ref": "#/$defs/text"},
        "next": {"description": "The table's Next for this state, as a command where it is one; null when there is nothing to do.", "type": ["string", "null"], "minLength": 1},
        "inputs": {"$ref": "#/$defs/inputs"}
      }
    },
    "contract": {
      "description": "The concern's front matter. An entry that is absent is an empty list or null.",
      "type": "object",
      "required": ["needs", "touches", "effects", "ships_to", "prs", "parked"],
      "additionalProperties": false,
      "properties": {
        "needs": {"type": "array", "items": {"$ref": "#/$defs/text"}},
        "touches": {"type": "array", "items": {"$ref": "#/$defs/text"}},
        "effects": {"type": "array", "items": {"$ref": "#/$defs/text"}},
        "ships_to": {"type": ["string", "null"], "minLength": 1},
        "prs": {"description": "As written: #<n>, or <owner>/<repo>#<n>.", "type": "array", "items": {"$ref": "#/$defs/text"}},
        "parked": {"description": "The D# that parks the concern.", "type": ["string", "null"], "minLength": 1}
      }
    },
    "claim": {
      "description": "A claim (C#) or a goal (G#), with every evidence line about it.",
      "type": "object",
      "required": ["id", "text", "struck", "evidence", "current_holds"],
      "additionalProperties": false,
      "properties": {
        "id": {"type": "string", "pattern": "^[CG][0-9]+$"},
        "text": {"$ref": "#/$defs/text"},
        "struck": {"description": "True when the claim is struck through (superseded); it then counts for no state.", "type": "boolean"},
        "evidence": {"description": "Its evidence lines, in file order; the last is the latest verdict.", "type": "array", "items": {"$ref": "#/$defs/evidence"}},
        "current_holds": {"description": "Whether it has a current HOLDS on the concern's ships-to environment (for a goal, on the loop's); null when that cannot be read.", "type": ["boolean", "null"]}
      }
    },
    "evidence": {
      "description": "One evidence line: YYYY-MM-DD · C1 · HOLDS · rung 1 · staging @<sha> · <evidence>.",
      "type": "object",
      "required": ["date", "verdict", "rung", "environment", "commit", "text"],
      "additionalProperties": false,
      "properties": {
        "date": {"type": "string", "pattern": "^[0-9]{4}-[0-9]{2}-[0-9]{2}$"},
        "verdict": {"$ref": "#/$defs/verdict"},
        "rung": {"type": "integer", "minimum": 1, "maximum": 6},
        "environment": {"$ref": "#/$defs/text"},
        "commit": {"description": "The commit it cites; null for @? (migrated without a commit), which never counts as a HOLDS.", "type": ["string", "null"], "pattern": "^[0-9a-f]{7,40}$"},
        "text": {"$ref": "#/$defs/text"}
      }
    },
    "inputs": {
      "description": "The facts the state came from. The fields named here have fixed meanings; the derivation may add other facts.",
      "type": "object",
      "required": ["main", "served", "prs", "commits"],
      "additionalProperties": true,
      "properties": {
        "main": {"description": "The main branch's head that was read.", "$ref": "#/$defs/sha"},
        "served": {"$ref": "#/$defs/served"},
        "prs": {"description": "The linked pull requests: by head branch, by Concern trailer in the body, or listed in prs.", "type": "array", "items": {"$ref": "#/$defs/pr"}},
        "commits": {"description": "Commits on main that carry the concern's Concern trailer.", "type": "array", "items": {"$ref": "#/$defs/sha"}},
        "branch": {"$ref": "#/$defs/branch"},
        "missing": {"description": "The facts that could not be read, each with why; set whenever the state is unknown.", "type": "array", "items": {"$ref": "#/$defs/text"}}
      }
    },
    "served": {
      "description": "The commit the concern's ships-to environment serves, or why it could not be read (exactly one of the two), and whether it serves every merge commit of the concern.",
      "type": "object",
      "required": ["environment", "commit", "error", "serves"],
      "additionalProperties": false,
      "properties": {
        "environment": {"description": "The ships-to environment; null when the contract has none.", "type": ["string", "null"], "minLength": 1},
        "commit": {"type": ["string", "null"], "pattern": "^[0-9a-f]{7,40}$"},
        "error": {"type": ["string", "null"], "minLength": 1},
        "serves": {"description": "Whether the served commit has every merge commit of the concern as an ancestor; false when nothing is merged; null when unknown.", "type": ["boolean", "null"]}
      },
      "oneOf": [
        {"properties": {"commit": {"type": "string"}, "error": {"type": "null"}}},
        {"properties": {"commit": {"type": "null"}, "error": {"type": "string"}, "serves": {"type": "null"}}}
      ]
    },
    "branch": {
      "description": "The concern's branch, <loop>/<concern>.",
      "type": "object",
      "required": ["name", "exists"],
      "additionalProperties": false,
      "properties": {
        "name": {"$ref": "#/$defs/text"},
        "exists": {"type": ["boolean", "null"]}
      }
    },
    "pr": {
      "type": "object",
      "required": ["repository", "number", "url", "title", "head", "base", "state", "draft", "merge_commit", "on_main", "checks"],
      "additionalProperties": false,
      "properties": {
        "repository": {"description": "owner/name.", "$ref": "#/$defs/text"},
        "number": {"type": "integer", "minimum": 1},
        "url": {"$ref": "#/$defs/text"},
        "title": {"$ref": "#/$defs/text"},
        "head": {"$ref": "#/$defs/text"},
        "base": {"$ref": "#/$defs/text"},
        "state": {"enum": ["open", "closed", "merged"]},
        "draft": {"type": "boolean"},
        "merge_commit": {"type": ["string", "null"], "pattern": "^[0-9a-f]{7,40}$"},
        "on_main": {"description": "Whether merge_commit is on its repository's main. Only then does the pull request count as merged. Null when it has no merge commit or that could not be read.", "type": ["boolean", "null"]},
        "checks": {"$ref": "#/$defs/ci_state"}
      }
    },
    "queue_item": {
      "description": "Something that needs a person. detail's shape follows kind.",
      "type": "object",
      "required": ["id", "kind", "title", "why", "loop", "concerns", "unblocks", "waits_on", "visible_to", "gate", "detail"],
      "additionalProperties": false,
      "properties": {
        "id": {"description": "A key that stays the same across runs while the item stands, such as <loop>/<concern>/Q1 or <owner>/<repo>#12.", "$ref": "#/$defs/text"},
        "kind": {"$ref": "#/$defs/queue_kind"},
        "title": {"description": "One line to show for it.", "$ref": "#/$defs/text"},
        "why": {"description": "Why it is in the queue, from the facts.", "$ref": "#/$defs/text"},
        "loop": {"description": "The loop it belongs to; null when it spans loops, as a ship can.", "type": ["string", "null"], "pattern": "^[A-Za-z0-9][A-Za-z0-9._-]*$"},
        "concerns": {"description": "The concerns it is about.", "type": "array", "items": {"$ref": "#/$defs/concern_ref"}, "uniqueItems": true},
        "unblocks": {"description": "The concerns that finishing it unblocks, counting through needs across loops. Its length orders the queue.", "type": "array", "items": {"$ref": "#/$defs/concern_ref"}, "uniqueItems": true},
        "waits_on": {"description": "The one person it waits on: the holder of its gate in LOOP.md §2 when it crosses one, otherwise the loop's owner. Null until addressing fills it.", "type": ["string", "null"], "minLength": 1},
        "visible_to": {"description": "The loop's members, who can see it but not act on it. Empty until addressing fills it.", "type": "array", "items": {"$ref": "#/$defs/text"}, "uniqueItems": true},
        "gate": {"description": "The gate in LOOP.md §2 it crosses, or null.", "type": ["string", "null"], "minLength": 1},
        "detail": {"type": "object"}
      },
      "oneOf": [
        {"properties": {"kind": {"const": "question"}, "detail": {"$ref": "#/$defs/question_detail"}}},
        {"properties": {"kind": {"const": "review"}, "detail": {"$ref": "#/$defs/review_detail"}}},
        {"properties": {"kind": {"const": "ship"}, "detail": {"$ref": "#/$defs/ship_detail"}}},
        {"properties": {"kind": {"const": "record"}, "detail": {"$ref": "#/$defs/record_detail"}}}
      ]
    },
    "question_detail": {
      "description": "An open question (Q#), or a contradiction that needs a call (then ref is the contradicted C#).",
      "type": "object",
      "required": ["ref", "question", "options", "recommendation", "blocks"],
      "additionalProperties": false,
      "properties": {
        "ref": {"description": "<loop>/Q3, <loop>/<concern>/Q1, or <loop>/<concern>/C2.", "$ref": "#/$defs/text"},
        "question": {"$ref": "#/$defs/text"},
        "options": {"description": "The options to choose from; none is pre-selected.", "type": "array", "items": {"$ref": "#/$defs/text"}},
        "recommendation": {"description": "The recommended answer, or the default if unanswered; null if there is none.", "type": ["string", "null"], "minLength": 1},
        "blocks": {"description": "What it blocks, as written in the Questions table.", "type": "array", "items": {"$ref": "#/$defs/text"}}
      }
    },
    "review_detail": {
      "description": "A pull request ready for review, or a loop-document pull request that check_loop_pr.sh refused.",
      "type": "object",
      "required": ["pr", "proof"],
      "additionalProperties": false,
      "properties": {
        "pr": {"$ref": "#/$defs/pr"},
        "proof": {"description": "The body's 'How it was proven before the merge' section, as Markdown; null if the body has none.", "type": ["string", "null"], "minLength": 1}
      }
    },
    "ship_detail": {
      "description": "Merged concerns waiting to ship to an environment.",
      "type": "object",
      "required": ["environment", "manual_steps"],
      "additionalProperties": false,
      "properties": {
        "environment": {"$ref": "#/$defs/text"},
        "manual_steps": {"description": "The concerns' declared effects, as the steps a person performs.", "type": "array", "items": {"$ref": "#/$defs/text"}}
      }
    },
    "record_detail": {
      "description": "Text to write on the person's yes, and where.",
      "type": "object",
      "required": ["path", "text"],
      "additionalProperties": false,
      "properties": {
        "path": {"$ref": "#/$defs/text"},
        "text": {"description": "The proposed text, as Markdown.", "$ref": "#/$defs/text"}
      }
    },
    "start": {
      "type": "object",
      "required": ["concern", "action", "command"],
      "additionalProperties": false,
      "properties": {
        "concern": {"$ref": "#/$defs/concern_ref"},
        "action": {"enum": ["build", "prove", "design"]},
        "command": {"description": "The command to run, such as /loop-build <loop>/<concern>.", "$ref": "#/$defs/text"}
      }
    },
    "drift": {
      "type": "object",
      "required": ["where", "finding", "checked"],
      "additionalProperties": false,
      "properties": {
        "where": {"description": "The file and the place in it, or the concerns involved.", "$ref": "#/$defs/text"},
        "finding": {"description": "What the text says, and what is actually true.", "$ref": "#/$defs/text"},
        "checked": {"description": "The command that established it.", "$ref": "#/$defs/text"}
      }
    },
    "missing_fact": {
      "type": "object",
      "required": ["fact", "error"],
      "additionalProperties": false,
      "properties": {
        "fact": {"$ref": "#/$defs/text"},
        "error": {"$ref": "#/$defs/text"}
      }
    }
  }
}
