{
  "schema_version": 1,
  "project": "example/new-project",
  "as_of": "2026-10-20T15:10:00Z",
  "main": {"branch": "main", "sha": "fd8245c193e4a4e6174481f7b5c1f6e8935b46d0", "ci": "none"},
  "environments": [
    {"name": "main", "served": "fd8245c193e4a4e6174481f7b5c1f6e8935b46d0", "error": null}
  ],
  "loops": [],
  "queue": [],
  "agents_can_start": [],
  "drift": [],
  "missing": []
}
